{
  "$schema": "https://agent-project-os.org/schemas/task-v1.schema.json",
  "acceptance_criteria": ["Service tests pass", "Consumer receipt is accepted"],
  "blocker": null,
  "created_at": "2026-08-14T00:20:00Z",
  "description": "Adopt the orders@2 contract and expose service-api@2.",
  "evidence_refs": ["service-e2", "service-e3"],
  "owner": "agent:claude-code",
  "priority": "high",
  "protocol_version": "1.0",
  "status": "done",
  "task_id": "consume-orders-v2",
  "title": "Consume orders@2",
  "updated_at": "2026-08-14T00:40:00Z"
}
