{
  "$schema": "https://agent-project-os.org/schemas/task-v1.schema.json",
  "acceptance_criteria": ["Schema examples pass deterministic validation"],
  "blocker": null,
  "created_at": "2026-08-14T00:00:00Z",
  "description": "Publish the synthetic orders@2 contract.",
  "evidence_refs": ["contracts-e2"],
  "owner": "agent:codex",
  "priority": "high",
  "protocol_version": "1.0",
  "status": "done",
  "task_id": "contract-v2",
  "title": "Publish orders@2",
  "updated_at": "2026-08-14T00:10:00Z"
}
