{
  "$schema": "https://agent-project-os.org/schemas/task-v1.schema.json",
  "acceptance_criteria": [
    "Founder/CEO/PMO/project-PM loop is executable through the public CLI",
    "Agent HR enforces independent evaluation, promotion and rollback",
    "Cadence and three client dispatch renderers remain deterministic and do not launch clients",
    "30 projects and 50 Agents pass the synthetic scale gate",
    "Public documentation describes the organization OS without exposing private topology"
  ],
  "blocker": null,
  "created_at": "2026-08-18T08:00:00Z",
  "description": "Implement the approved Agent Project OS completeness roadmap through the public v0.4 alpha candidate while preserving private migration and release gates.",
  "evidence_refs": [
    "organization-os-v0.4-e2"
  ],
  "owner": "agent:codex",
  "priority": "high",
  "protocol_version": "1.0",
  "status": "done",
  "task_id": "complete-organization-os-v0.4",
  "title": "Complete the local AI engineering organization OS",
  "updated_at": "2026-08-18T08:10:52Z"
}
